name,description,ingredients,protein,carbs,fat,calories,dietrestrict,image,cost
Grilled Chicken Salad,A healthy and delicious salad with grilled chicken mixed greens cherry tomatoes cucumbers and a light vinaigrette dressing,"['Grilled Chicken','Mixed Greens','Cherry Tomatoes','Cucumbers','Vinaigrette Dressing']",25,15,10,300,"['Gluten-Free','Dairy-Free']",https://www.eatingbirdfood.com/wp-content/uploads/2023/06/grilled-chicken-salad-hero-1024x1536.jpg,50
Quinoa Avocado Bowl, A nutrient-packed bowl featuring quinoa avocado black beans corn red bell peppers and a zesty lime dressing,"['Quinoa','Avocado','Black Beans','Corn','Red Bell Peppers','Lime Dressing']",18,30,12,280,"['Vegetarian','Vegan']",https://www.eatingwell.com/thmb/tg6LiRCRQ93arc1hgRFQ8xsAPLU=/750x0/filters:no_upscale():max_bytes(150000):strip_icc():format(webp)/53296331-a4a2dacb472347eaba4d8a87f60af6d0.jpg,60
Salmon Teriyaki Stir-Fry,A flavorful stir-fry dish with grilled salmon mixed vegetables and a savory teriyaki sauce served over brown rice,"['Salmon','Mixed Vegetables','Teriyaki Sauce','Brown Rice']",22,35,8,320,"['Pescatarian']",https://www.thefoodblog.net/wp-content/uploads/2023/04/salmon-stir-fry-6-of-13.jpg,40
Lentil Spinach Soup,A hearty soup made with lentils fresh spinach carrots celery onions and a blend of aromatic spices,"['Lentils','Spinach','Carrots','Celery','Onions','Spices']",12,20,5,200,"['Vegetarian','Vegan','Gluten-Free']",https://ifoodreal.com/wp-content/uploads/2022/01/lentil-spinach-soup-recipe-1017x1536.jpg,20
Greek Yogurt Parfait,A refreshing parfait layered with Greek yogurt fresh berries granola and a drizzle of honey,"['Greek Yogurt','Berries','Granola','Honey']",10,25,6,180,"['Vegetarian']",https://foolproofliving.com/wp-content/uploads/2022/07/Fruit-and-yogurt-parfait.jpg,35